{
  "schema_version": "aoa_routing_two_stage_router_prompt_blocks_v2",
  "schema_ref": "routing/two-stage-skill-selection/schemas/two-stage-router-prompt-blocks.schema.json",
  "owner_repo": "aoa-routing",
  "surface_kind": "two_stage_router_prompt_blocks",
  "profile": "aoa-routing-two-stage-skill-router",
  "policy_ref": "routing/two-stage-skill-selection/config/two_stage_router_policy.json",
  "validation_refs": [
    "routing/two-stage-skill-selection/scripts/build_two_stage_skill_router.py",
    "routing/two-stage-skill-selection/scripts/validate_two_stage_skill_router.py",
    "routing/two-stage-skill-selection/tests/test_two_stage_skill_router.py"
  ],
  "low_context_boundary": {
    "wording_scope": "routing-owned",
    "source_payload_copying": "forbidden",
    "stage_1_source_refs": [
      "aoa-skills:generated/tiny_router_capsules.min.json",
      "aoa-skills:generated/tiny_router_candidate_bands.json",
      "aoa-skills:generated/tiny_router_skill_signals.json"
    ],
    "stage_2_source_refs": [
      "aoa-skills:generated/skill_capsules.json",
      "aoa-skills:generated/local_adapter_manifest.json",
      "aoa-skills:generated/context_retention_manifest.json"
    ],
    "forbidden_source_payload_fields": [
      "summary",
      "trigger_boundary_short",
      "verification_short",
      "skill_path",
      "allowlist_paths",
      "rehydration_hint",
      "context_rehydration_hint",
      "companions"
    ]
  },
  "stage_1_token_budget": 1200,
  "stage_2_shortlist_limit": 3,
  "tiny_preselector_system": "You are a tiny skill preselector. Read only compressed skill cards, candidate bands, and their cues. Never activate a skill. Return at most 3 positive-signal candidate names, confidence metadata, and any out-of-band fallback visibility. Never treat fallback candidates as the live shortlist.",
  "main_model_decision_system": "You are the stage-2 skill decider. Read only the shortlist packet and the full capsules for shortlisted skills. The shortlist must stay at or below 3 candidates. Choose at most one skill or no skill. Weak or empty shortlists must stay no-skill. Explicit-only skills must stay manual.",
  "handoff_contract": [
    "stage 1 narrows the candidate set",
    "stage 1 never activates a skill",
    "stage 2 may activate one candidate, require a manual handle, or choose no skill",
    "explicit-only skills stay manual even when they win stage 1",
    "fallback candidates stay out-of-band and do not replace the shortlist",
    "weak or empty shortlists must end in no-skill"
  ]
}
